course_code,course_name,credit_hours,description
AH 107,Medical Office Procedures,3,"Offered in Fall, Winter Terms (2-2-0) This course is designed to provide the theoretical basis and practical application for performing clinical procedures in the medical office/clinic setting. Included are introduction to medical assisting; patient assessment including taking a medical history, interviewing patients and vital signs; documentation of care; preparing patients for examinations and procedures; principles of asepsis; phlebotomy; interpersonal communications; and legal issues. PREREQUISITE(S): AH 130 , OAS 116 , Admission to the MA program. Master Syllabi: https://share.ncmich.edu/academics/master_syllabi"
AH 108,Medical Office Procedures II,3,"Offered in Fall, Winter Terms (2-2-0) A continuation of AH 107 . This course is designed to provide the theoretical basis and practical application for performing clinical procedures in the medical office/clinic setting. Included are specimen collection and laboratory procedures; diagnostic tests, x-rays and procedures; introduction to principles of psychology; care of the geriatric and pediatric patient; developmental stages; common diseases and diagnoses; medical emergencies; professionalism; medical ethics; and accreditation of medical office assistants. AH 108 must be completed before taking AH 285 . PREREQUISITE(S): AH 107 and AH 180 . Master Syllabi: https://share.ncmich.edu/academics/master_syllabi"
AH 116,Math For Health Professionals,2,"Offered in Fall Term (2-0-0) Designed for students majoring in nursing or allied health with an emphasis on math necessary for safe drug dosage calculation and medication administration. Topics will include solving problems and equations using fractions, decimals, percents, as well as using formulas and dimensional analysis. An overview of the metric system will also be provided. Emphasis will be placed on solving problems using drug calculations for medication administration. PREREQUISITE(S): Admission to the nursing program. Master Syllabi: https://share.ncmich.edu/academics/master_syllabi"
AH 118,Navigating the Healthcare System,3,"Offered in Fall Term (3-0-0) Focuses on the challenges individuals (and especially elder individuals) face in understanding and “navigating” the modern healthcare system in the United States with special emphasis on the balance between an individual’s maintaining independence or selecting among a variety of options for assistance. Topics to be addressed include recognition of and access to different levels of the healthcare system (primary, secondary, tertiary care), selection and implementation of different types of insurance (Medicare, Medicaid, private insurers, Medi-Gap, healthcare exchanges), local vs. national solutions in delivery of healthcare options, recognition of patient rights and responsibilities, and the role of patient advocates. Master Syllabi: https://share.ncmich.edu/academics/master_syllabi"
AH 130,Body Systems And Diseases,3,"Offered in Fall, Winter Terms (3-0-0) An applied course designed for the medical assistant that provides an introduction to each body system and common diseases and conditions. Emphasizes core knowledge of anatomy as it relates to clinical practice. The student will examine knowledge related to fundamental concepts of diseases necessary to understand procedures and techniques commonly encountered in the clinical setting. Master Syllabi: https://share.ncmich.edu/academics/master_syllabi"
AH 154,Certified Nurse Aide Training,5,"Offered in Fall, Winter, Summer Terms (3-2-2) Prepares students for work as a certified nurse’s aide. Course includes academic instruction, hands-on practice in the laboratory setting and clinical instruction in a long-term care facility. Upon successful completion of the course, students are eligible to take the certified nurse aide examination in the state of Michigan. Students will be required to meet immunization standards of the clinical facilities and will be subject to a criminal background check prior to being able to participate in clinical instruction. Students should be advised that clinical instruction may take place outside of times allotted for normal classroom or lab time. Master Syllabi: https://share.ncmich.edu/academics/master_syllabi"
AH 180,Pharmacology For Allied Health,3,"Offered in Fall, Winter Terms (3-0-0) An applied pharmacology course designed for the Allied Health student. Emphasis is on safe, accurate administration of medications typically given in an allied health setting. The student will acquire knowledge of drug actions, major side effects and techniques of administration. PREREQUISITE(S): B 104 or MATH 100 or MATH 110 or higher, AH 130 or BIO 133 or BIO 235 Master Syllabi: https://share.ncmich.edu/academics/master_syllabi"
AH 182,Pharmacology For Surgical Technologists,4,"Offered in Fall, Winter Terms (4-0-0) An applied pharmacology course designed for the Surgical Technology student. Emphasis is on safe, accurate administration of medications typically given in a surgical setting. The student will acquire knowledge of drug actions, major side effects and techniques of administration, in addition to specific additional instruction and practice in the relevant medications and procedures unique to the surgical setting. PREREQUISITE(S): BIO 226 , BIO 235 and MATH 110 or higher. Master Syllabi: https://share.ncmich.edu/academics/master_syllabi"
AH 240,Pathophysiology,4,"Offered in Fall, Winter Terms (4-0-0) Pathophysiology is the study of abnormal function in living tissue. Physiological principles underlying the causes, signs, symptoms, and pattern of development of human disease will be examined. Recommended that BIO 235 , BIO 236 , CEM 101 be taken before AH 240. Master Syllabi: https://share.ncmich.edu/academics/master_syllabi"
AH 254,Advanced Certified Nurse Aide Skills,4,"Offered in Winter Term (2-2-3) Advanced preparation for CNAs for the role of assistive personnel and the latest trends in healthcare. The course will cover crossover skills needed to work in varied healthcare settings such as acute, subacute, home health, hospices and long-term care. Skills taught include venipuncture, respiratory care, wound care, electrocardiograms, catheterization and other technical skills. PREREQUISITE(S): AH 154 or current certification as CNA. Master Syllabi: https://share.ncmich.edu/academics/master_syllabi"
AH 280,Pharmacology,3,"Offered in Winter Term (3-0-0) An Introduction to the general principles of drugs and how they alter biological functions. Instruction focuses on the effects of specific drugs on body systems including: the autonomic nervous system; and the cardiovascular, respiratory, endocrine and immune systems. In addition, the pharmacology of antibiotics and chemotherapeutics is covered. Special emphasis is placed on the importance of the understanding of pharmacology with respect to nursing practice. PREREQUISITE(S): BIO 235 , BIO 236 and NUR 110 . Master Syllabi: https://share.ncmich.edu/academics/master_syllabi"
AH 285,Work Based Learning-Medical Assistant I,4,"Offered in Fall, Winter, Summer Terms (1-0-12) Students in this course are placed in a medical office for a minimum of 160 hours of externship experience, where they will be working directly with a Medical Assistant or Registered Nurse to enhance administrative and clinical skills they have acquired in AH 107 and AH 108 (Medical Office Procedures I and II). Students will complete task lists for these skills that will be monitored both by medical office staff and North Central’s clinical instructor. In addition, students will also spend one hour each week in review for the Registered Medical Assistant exam which they can take following successful completion of AH 285 and the Medical Assistant program. Students will typically meet with Allied Health faculty and staff near the end of AH 108 in preparation for their externship placements in the following term. PREREQUISITE(S): AH 107 , AH 108 , AH 180 , OAS 190 , OAS 220 and OAS 221 . Master Syllabi: https://share.ncmich.edu/academics/master_syllabi"
AH 292,Work Based Learning - Eldercare,1,"Offered in Winter Term (0-0-4) Students in this course are placed at a work site where they can deepen their experience working with an elderly population in either a medical, business, legal or social services capacity. Students will complete task lists for these skills that will be monitored by the Eldercare work-based learning coordinator. PREREQUISITE(S): Based on student’s curriculum. Master Syllabi: https://share.ncmich.edu/academics/master_syllabi"
AH 297,Special Topics In Allied Health,2,Offered in Variable Terms (2-0-0) Special topics classes provide students opportunities for focused study with full-time or adjunct instructors teaching in their areas of expertise. Topics will vary. Master Syllabi: https://share.ncmich.edu/academics/master_syllabi
ANM 110,Animation I: Introduction to Animation,3,"Offered in Fall, Winter Terms (3-0-0) Introduction to the fundamental methods, practices and principles of animation, while exploring the artisans, both past and present, responsible for establishing the art form. Students will have the opportunity to experiment with the fourth dimension, using various time-based techniques: hand-drawn, also known as frame-by-frame animation, stop-motion, claymation, mixed media, pixilation and much more. Each class session will consist of demonstrations, viewings of related works, hands-on experimentation, as well as critiques. Weekly assignments will further students’ skill sets, as well as their exposure to, and understanding of, time-based art. In particular, students will conduct experiments centered on the 12 concepts and principles of animation. Lastly, students will gain knowledge and experience with post-production practices through the use of various software programs, including, but not limited to, iMovie, Photoshop and After Effects. Upon completion of this course, students will have a basic working knowledge of how art, time and kinesthetics come together to create the lighthearted, narrative art form known as animation. Master Syllabi: https://share.ncmich.edu/academics/master_syllabi"
ANM 120,Animation II: From Motion to Film,3,"Offered in Winter Term (3-0-0) A continuation of Animation I. Students will be asked to further explore the fundamental methods, practices and principles of animation through various mediums. Acquiring skills for acting, character building, sound design and storytelling will be of the utmost importance. As a result, students will begin to address the making of complete films, from concept to post-production. Weekly assignments and experiments will continue expanding each students’ understanding of basic animation concepts; a true understanding of these concepts will demand a certain level of refinement where the 12 basic principles of animation are concerned. In order to properly exhibit a complete understanding of these concepts, students will be required to develop, create and present a final animated short in a medium of their choosing. Lastly, students will delve deeper into the post-production process, and will continue the use of various software programs, including, but not limited to, iMovie, Photoshop and After Effects. Upon completion of this course, students will possess the aesthetics, design abilities and time-based skill sets necessary in order to succeed in the animation industry. PREREQUISITE(S): ANM 110 Master Syllabi: https://share.ncmich.edu/academics/master_syllabi"
ANM 140,Character Design,3,"Offered in Fall Term (3-0-0) Characters are the essential component necessary in the successful creation of any and all stories. This course will expose students to the “how” of character design and development, affording them a knowledge base that will serve a crucial role in their professional careers. A large variety of illustrative approaches and techniques will be utilized by students, all of which will give students an opportunity to push themselves and think outside of the provincial box. These techniques include, and are not limited to: two-dimensional forms, sculpture, digital formats, as well as mixed media. Lectures will include demonstrations, discussion, technical exploration, aesthetic inquiry and historically relevant information regarding character design. Research, both historical and modern, experimentation and client-based projects will be disbursed over the course of the semester, leaving students with quality portfolio pieces. Master Syllabi: https://share.ncmich.edu/academics/master_syllabi"
ANM 297,Special Topics - Animation,3,Offered in Variable Terms (3-0-0) Special topics classes provide students opportunities for focused study with full-time or adjunct instructors teaching in their areas of expertise. Topics will vary. Master Syllabi: https://share.ncmich.edu/academics/master_syllabi
ANM 299,Independent Study - Animation,3,Offered in Variable Terms (3-0-0) A course offering students the opportunity to conduct in-depth studies in their field of interest. Students make arrangements for a project under the supervision of an instructor in the discipline. Master Syllabi: https://share.ncmich.edu/academics/master_syllabi
ANP 110,Cultural Anthropology,3,"Offered in Fall, Winter Terms (3-0-0) This class is an introduction to the study of past and present cultural diversity throughout the world. Students learn major subfield methods, theories and issues and how to apply them to the study and understanding of human cultural variation. Topics covered during lecture, class discussion and activities include the social, political, economic and religious systems of diverse societies. GENERAL EDUCATION DISTRIBUTION AREA: Social Science Master Syllabi: https://share.ncmich.edu/academics/master_syllabi"
ANP 130,Introduction To Prehistoric Archeology,3,"Offered in Winter Term (3-0-0) This course introduces the student to the theories, methods and practices of prehistoric archaeology. This will be accomplished through the evaluation, analysis and interpretation of archaeological data from sites around the world. GENERAL EDUCATION DISTRIBUTION AREA: Social Science Master Syllabi: https://share.ncmich.edu/academics/master_syllabi"
ANP 210,Ethnology Of World Cultures,3,"Offered in Winter Term (3-0-0) An ethnographic survey of societies at different levels of socioeconomic development. Topics discussed include environment, politics, gender, economics, family and kinship, marriage and religion in hunting and gathering, horticultural, agrarian, industrial and postindustrial societies. No prerequisite but ANP 110 is recommended. GENERAL EDUCATION DISTRIBUTION AREA: Social Science Master Syllabi: https://share.ncmich.edu/academics/master_syllabi"
ANP 295,Field Studies In Anthropology,3,"Offered in Variable Terms (3-0-0) This course offers students the opportunity to explore and analyze past and/or present human cultural diversity during an extended field experience. Students will be expected to participate in anthropological and/or archaeological fieldwork for the duration of the field experience. The destination, schedule of events, student responsibilities, and number of credits will vary and will be announced prior to class registration. Course fees will reflect trip expenses. PREREQUISITE(S): Instructor’s permission. Master Syllabi: https://share.ncmich.edu/academics/master_syllabi"
ANP 297,Special Topics - Anthropology,3,Offered in Variable Terms (3-0-0) Special Topics classes provide students opportunity for focused study with full-time or adjunct instructors teaching in their areas of expertise. Topics will vary. Master Syllabi: https://share.ncmich.edu/academics/master_syllabi
ANP 299,Independent Study - Anthropology,3,Offered in Variable Terms (3-0-0) A course offering students the opportunity to conduct in-depth studies in their field of interest. Students make arrangements for a project under the supervision of an instructor in the discipline. Master Syllabi: https://share.ncmich.edu/academics/master_syllabi
ARB 111,Elementary Modern Standard Arabic I,5,"Offered in Fall, Winter Terms (5-0-0) The first of two-term sequence in elementary Arabic. It introduces the students to Modern Standard Arabic while learning about the aspects of Arab culture connected to daily life. This course focuses on the sounds and characters of the alphabet with basic writing of Modern Standard Arabic (MSA) combined with oral basic communication practice. Training in listening, speaking, reading and writing is given. GENERAL EDUCATION DISTRIBUTION AREA: Humanities Master Syllabi: https://share.ncmich.edu/academics/master_syllabi"
ARB 112,Elementary Modern Standard Arabic II,5,"Offered in Fall, Winter Terms (5-0-0) Enhances proficiency in Arabic and is a continuation of ARB 111 . Emphasis is placed on listening and reading for comprehension as well as speaking and writing for real life purposes through an acquisition of applied vocabulary and grammar. This course broadens student expression of perspectives and appreciation of Arabic culture. PREREQUISITE(S): ARB 111 GENERAL EDUCATION DISTRIBUTION AREA: Humanities Master Syllabi: https://share.ncmich.edu/academics/master_syllabi"
ARC 110,Elements Of Architecture,3,Offered in Fall Term (3-0-0) An introductory course in understanding the elements and meaning of architecture. The intent of the course is to provide a broad view of the factors and issues that translate need and purpose into architectural form. Students will become familiar with images of architecture drawn from various times and cultures. Projects and exercises will apply the knowledge and skills acquired in the class. Master Syllabi: https://share.ncmich.edu/academics/master_syllabi
ARC 297,Special Topics - Architecture,3,Offered in Variable Terms (3-0-0) Special Topics classes provide students opportunity for focused study with full-time or adjunct instructors teaching in their areas of expertise. Topics will vary. Master Syllabi: https://share.ncmich.edu/academics/master_syllabi
ARTH 110,Art History I,3,"Offered in Fall, Winter Terms (3-0-0) An introduction to the history of painting, sculpture and architecture from prehistoric to Medieval times. Students become acquainted with the arts of the past. Art forms are examined both for individual qualities and for the way they exemplify changes in Western cultural patterns. GENERAL EDUCATION DISTRIBUTION AREA: Humanities (formerly ART 105) Master Syllabi: https://share.ncmich.edu/academics/master_syllabi"
ARTH 111,Art History II,3,"Offered in Winter, Summer Terms (3-0-0) A survey of the history of art from the 14th century through the early 20th century. Students will place the arts within the context of world geography, history, politics and religion to understand the relevance of art to contemporary life. GENERAL EDUCATION DISTRIBUTION AREA: Humanities (formerly ART 106) Master Syllabi: https://share.ncmich.edu/academics/master_syllabi"
ARTH 112,History of Non-Western Art,3,"Offered in Fall Term (3-0-0) An introduction to painting, sculpture and architecture from prehistoric to contemporary times in the cultures of Asia, Africa and the Americas. The production of artwork and architecture is examined in an effort to explain their aesthetic qualities, as well as the stories they tell of the cultures and peoples that produced them. GENERAL EDUCATION DISTRIBUTION AREA: Humanities (formerly ART 115) Master Syllabi: https://share.ncmich.edu/academics/master_syllabi"
ARTH 113,History of Modern Art,3,Offered in Winter Term (3-0-0) The study of Modern Art from Cubism through the 21st century. (formerly ART 117) Master Syllabi: https://share.ncmich.edu/academics/master_syllabi
ARTH 295,Field Studies - Art History,4,"Offered in Variable Terms (4-0-0) A field class in which students will travel to various locations to study architecture, monuments, memorials, sculptures and museum collections. Time periods studied may range from ancient to contemporary. Descriptions of specific activities, locations, credit values and student responsibilities will vary and be announced prior to class registration. Course fees will reflect trip expenses. Master Syllabi: https://share.ncmich.edu/academics/master_syllabi"
ARTH 297,Special Topics - Art History,3,Offered in Variable Terms (3-0-0) Special topics classes provide students opportunities for focused study with full-time or adjunct instructors teaching in their areas of expertise. Topics will vary. Master Syllabi: https://share.ncmich.edu/academics/master_syllabi
ARTH 299,Independent Study - Art History,3,Offered in Variable Terms (3-0-0) A course offering students the opportunity to conduct in-depth studies in their field of interest. Students make arrangements for a project under the supervision of an instructor in the discipline. Master Syllabi: https://share.ncmich.edu/academics/master_syllabi
ARTS 100,Two-Dimensional Design,3,Offered in Fall Term (3-0-0) A basic introduction to the visual world. The student will develop a visual vocabulary and build an understanding of the elements and principles of design as they apply to work in two dimensions. Several mediums will be explored. (formerly ART 100) Master Syllabi: https://share.ncmich.edu/academics/master_syllabi
ARTS 101,Three-Dimensional Design,3,"Offered in Winter Term (3-0-0) Introduces students to the basic principles and elements of design as they apply to three-dimensional form and space. Students work with a variety of media in additive, subtractive and modular approaches to making forms in three dimensions. (formerly ART 102) Master Syllabi: https://share.ncmich.edu/academics/master_syllabi"
ARTS 102,Basic Drawing and Composition,3,"Offered in Fall, Winter Terms (3-0-0) An introduction to the techniques of drawing with various black and white media, including their use in the manipulation of the elements of composition in both representational and non-objective art. (formerly ART 109) Master Syllabi: https://share.ncmich.edu/academics/master_syllabi"
ARTS 103,Color Theory,3,"Offered in Fall, Winter Terms (3-0-0) Explores color properties, color harmonies and systematic color relationships as they pertain to visual communication. This foundation course to help students gain a command of and a confidence in the use of color. (formerly ART 101) Master Syllabi: https://share.ncmich.edu/academics/master_syllabi"
ARTS 104,Life Drawing,3,"Offered in Winter Term (3-0-0) An introduction to drawing the figure in various media. Techniques of gesture, contour and proportions, along with their integration into coherent compositions are included. Live, nude models will be employed as subjects for this course. (formerly ART 212) Master Syllabi: https://share.ncmich.edu/academics/master_syllabi"
ARTS 110,Drawing Studio Intensive I,3,"Offered in Fall, Winter Terms (3-0-0) Allows the student to pursue advanced, independent work in drawing. Emphasis will be on helping the student develop an independent working method, formulate a personal style and learn pertinent aspects of drawing in various media. PREREQUISITE(S): ARTS 102 and ARTS 104 . Master Syllabi: https://share.ncmich.edu/academics/master_syllabi"
ARTS 116,Drawing Studio Intensive II,3,"Offered in Fall, Winter Terms (3-0-0) A second semester of honing advanced, independent work in drawing. Emphasis will be on helping the student develop an independent working method, formulate a personal style and learn pertinent aspects of drawing in various media. PREREQUISITE(S): ARTS 110 Master Syllabi: https://share.ncmich.edu/academics/master_syllabi"
ARTS 118,Drawing Studio Intensive III,3,"Offered in Fall, Winter Terms (3-0-0) A third semester of honing advanced, independent work in drawing. Emphasis will be on helping the student develop an independent working method, formulate a personal style and learn pertinent aspects of drawing in various media. PREREQUISITE(S): ARTS 116 Master Syllabi: https://share.ncmich.edu/academics/master_syllabi"
ARTS 120,Art for Educators,3,Offered in Winter Term (3-0-0) Students integrate art with other curricula to strengthen student learning in both areas. A strong foundation in the elements and principles of design will underpin all projects. (formerly ART 120) Master Syllabi: https://share.ncmich.edu/academics/master_syllabi
ARTS 125,Anishinaabe Art,3,Offered in Fall Term (3-0-0) An introduction to Anishinaabe art of the Great Lakes region. (formerly ART 125) Master Syllabi: https://share.ncmich.edu/academics/master_syllabi
ARTS 200,Ceramics I,3,"Offered in Fall, Winter Terms (3-0-0) An introduction to expose the student to the possibilities of clay work, with an emphasis on hand building and an introduction to throwing on the potter’s wheel. Students will learn surface design and firing methods. (formerly ART 204) Master Syllabi: https://share.ncmich.edu/academics/master_syllabi"
ARTS 201,Ceramics II,3,"Offered in Fall, Winter Terms (3-0-0) Builds on the knowledge and skills acquired in Ceramics I, with an emphasis on developing throwing and hand building skills. An introduction to glaze composition and an opportunity to explore firing options is included. PREREQUISITE(S): ARTS 200 (formerly ART 205) Master Syllabi: https://share.ncmich.edu/academics/master_syllabi"
ARTS 204,Ceramics Studio Intensive I,3,"Offered in Fall, Winter Terms (3-0-0) Allows the student to pursue advanced, independent work in ceramics. Emphasis will be on helping the student develop an independent working method, formulate a personal style and learn all aspects of ceramics studio operation. PREREQUISITE(S): ARTS 201 Master Syllabi: https://share.ncmich.edu/academics/master_syllabi"
