course_code,course_name,credit_hours,description
HCA 1230,Patient Care and Auxiliary Relationships in Health Care Facilities,3,"Corequisite: HCA 1000 or consent of program coordinator. (Required) The student will gain insight into the problems and practices of patient care, state regulations, rehabilitation concepts, environmental health, food administration, recreational programming, and utilization review. BILLABLE CONTACT HOURS: 3 Corequisite: HCA 1000 or consent of program coordinator. (Required) The student will gain insight into the problems and practices of patient care, state regulations, rehabilitation concepts, environmental health, food administration, recreational programming, and utilization review. BILLABLE CONTACT HOURS: 3"
HCA 2100,Personnel Management in Health Care Facilities,3,"Corequisite: HCA 1000 or consent of program coordinator. (Required) The student will gain an understanding of management principles and skills practiced for the health care industry. The student will apply these principles to recruitment and personnel selection, training and development, organization, labor relations, techniques of motivation and communication and appraisal programs. BILLABLE CONTACT HOURS: 3 Corequisite: HCA 1000 or consent of program coordinator. (Required) The student will gain an understanding of management principles and skills practiced for the health care industry. The student will apply these principles to recruitment and personnel selection, training and development, organization, labor relations, techniques of motivation and communication and appraisal programs. BILLABLE CONTACT HOURS: 3"
HCA 2150,Labor Practices in Health Care Facilities,2,"Corequisite: HCA 1000 or consent of program coordinator. (Required) The student will develop skills and techniques needed in employer/employee relations unique to the health care field. The student will be able to design grievance procedures, interact with union representatives, negotiate and implement contracts and mediate disputes. BILLABLE CONTACT HOURS: 2 Corequisite: HCA 1000 or consent of program coordinator. (Required) The student will develop skills and techniques needed in employer/employee relations unique to the health care field. The student will be able to design grievance procedures, interact with union representatives, negotiate and implement contracts and mediate disputes. BILLABLE CONTACT HOURS: 2"
HCA 2200,Fiscal Management in Health Care Facilities,3,"Corequisite: HCA 1000 or consent of program coordinator. (Required) The student will learn and apply accounting techniques to budgeting, cost controls and cost analysis in the health care facility. The student will also become familiar with the principles of the reimbursement formulas and various types of insurance coverage. BILLABLE CONTACT HOURS: 3 Corequisite: HCA 1000 or consent of program coordinator. (Required) The student will learn and apply accounting techniques to budgeting, cost controls and cost analysis in the health care facility. The student will also become familiar with the principles of the reimbursement formulas and various types of insurance coverage. BILLABLE CONTACT HOURS: 3"
HCA 2250,Legal Aspects of Health Service Management,3,"Corequisite: HCA 1000 or consent of program coordinator. (Required) The student will become familiar with the legal and historical background of the health care field, corporate liability, negligence, and malpractice concepts. Emphasis will be placed on methods of preventing legal action rather than on defense. The student will also gain an understanding of ethical conduct related to patient care. BILLABLE CONTACT HOURS: 3 Corequisite: HCA 1000 or consent of program coordinator. (Required) The student will become familiar with the legal and historical background of the health care field, corporate liability, negligence, and malpractice concepts. Emphasis will be placed on methods of preventing legal action rather than on defense. The student will also gain an understanding of ethical conduct related to patient care. BILLABLE CONTACT HOURS: 3"
HCA 2300,Problems and Policies of Health Care Facilities,3,"Corequisite: HCA 1000 or consent of program coordinator. (Required) The student will gain insight into the role of the health care facility in relation to the patient, the patient's family, the community and other related facilities. The student will discuss problems and policies relating to medical staff relationships, absenteeism, vandalism and patient abuse. The student will also be able to write a typical policy manual. BILLABLE CONTACT HOURS: 3 Corequisite: HCA 1000 or consent of program coordinator. (Required) The student will gain insight into the role of the health care facility in relation to the patient, the patient's family, the community and other related facilities. The student will discuss problems and policies relating to medical staff relationships, absenteeism, vandalism and patient abuse. The student will also be able to write a typical policy manual. BILLABLE CONTACT HOURS: 3"
HCA 2403,HCA Externship,3,An externship will be required for students. The students will be assigned to selected health care facilities. A weekly discussion will be required to assess goals and discuss progress. BILLABLE CONTACT HOURS: 3
HCA 2404,HCA Externship,4,An externship will be required for students. The students will be assigned to selected health care facilities. A weekly discussion will be required to assess goals and discuss progress. BILLABLE CONTACT HOURS: 4
HVA 1114,Introduction to Refrigeration,4,"The student will learn the basic principles of 25 current refrigeration systems and their application to the refrigeration cycle. Each type of unit is examined to determine function, best operating procedures and physical requirements. BILLABLE CONTACT HOURS: 4"
HVA 1120,Sheet Metal Layout and Fabrication,3,"This introductory, hands-on course will cover the process of layout and fabrication of standard sheet metal fittings. The student, through the use of demonstrations and laboratory exercises, will design and construct duct work and fittings. BILLABLE CONTACT HOURS: 3.5"
HVA 1150,Basic Principles of HVACR Controls,4,"This introductory course is designed to provide a functional approach to HVACR controls. Emphasis will be placed on the basics of AC and DC and basic electrical and electronic circuits. Lab experiences will be provided through kits, components, and hot equipment. BILLABLE CONTACT HOURS: 4.5"
HVA 1210,Domestic and Commercial Refrigeration,4,"This course is designed to integrate the theory and troubleshooting consideration of domestic hermetic refrigerator and freezer systems with the theory and application of light commercial refrigeration with systems, such as walk-in coolers, reach-in and display coolers, ice machines, and multievaporator systems. Emphasis on head pressure control, pump-down systems and capacity control will be given. BILLABLE CONTACT HOURS: 4.5"
HVA 1220,Commercial Refrigeration II,3,"The student will learn the theory, application, operation, selection, installation and repair of common commercial refrigeration units such as ice machines, walk-in refrigerators and commercial storage units, covering topics such as: system components, controls, compressors, condensers, receivers, cooling towers and water treatment, defrosting, motor protectors, capacitors, accessories and dehydration. BILLABLE CONTACT HOURS: 3"
HVA 1310,"Heating, Ventilation, Air Conditioning and Refrigeration Design I",4,"The student will develop the skills and abilities to use the concepts of human comfort and air conditioning system performance in the analysis of psychrometric properties, as well as to apply American Society of Heating, Refrigeration and Air Conditioning Engineers guide data to performing a comprehensive heat loss and gain analysis on residential and light commercial buildings. Additional emphasis will be given to computerized load and duct calculations. Lab experiments will be structured to reinforce the principles of equipment performance and servicing requirements. Students planning to transfer into an Engineering Technology program should take PHY 1610 instead of APP 2170 . BILLABLE CONTACT HOURS: 4.5"
HVA 1390,"Heating, Ventilation, Air Conditioning and Refrigeration Design II",3,"The student will be required to analyze system heat loss and gain and apply air flow design principles to the design of duct and hydronic systems. In addition, the student will be exposed to the theory of mechanical refrigeration and heat pump application as it relates to the design process. Control theory and zoning requirements will be studied, as well as their application to the several types of air conditioning systems found in the field. Emphasis will be given to lab performance objectives pertinent to servicing package equipment, as well as use of the computer to calculate load and duct sizing and piping systems. BILLABLE CONTACT HOURS: 4"
HVA 1404,Cooperative Internship,4,"The student will be employed within his trade area in a supervised situation under the guidance of a coordinator. The student will identify and describe, through reports and position papers, technical problems encountered on the job. BILLABLE CONTACT HOURS: 4"
HVA 1430,Residential and Commercial Control Systems,4,"The student will learn to read and interpret residential and light commercial wiring diagrams by identifying and tracing the schematics of several types of heating, refrigeration and air conditioning systems. Considerable emphasis on electrical problem solving will be given by lab simulators and trainers and troubleshooting. BILLABLE CONTACT HOURS: 4.5"
HVA 1522,Refrigeration Code,2,"This course provides the student or apprentice with the refrigeration safety code of the American Standard Association as approved by the American Society of Heating, Refrigerating and Air Conditioning Engineers. The topics considered are scope and purpose, definitions, refrigeration systems classification, refrigerant classification, systems required for various establishments, installation requirements, piping, valves, fittings, and related parts, safety devices, design and construction of equipment, refrigerant containing pressure vessels, methods of field tests and instructions. BILLABLE CONTACT HOURS: 2"
HVA 1610,Heating Technology I,4,"This course is designed to teach the student the theory, installation requirements, and troubleshooting practices of residential gas-forced air heating systems. Additional emphasis will be placed on heating controls and the application of modern high-tech energy efficient residential and commercial heating systems. Biomass combustion systems and system operations will also be discussd. BILLABLE CONTACT HOURS: 4.5"
HVA 1630,Heating Technology II,3,"This course will provide the student with a comprehensive exposure to the theory, operation and services of gas, oil, solar, and biomass forced air, hot water boilers and steam boiler systems. Additional consideration will be given to operational sequence and service of hot water boilers that use back-up solar heat and its control system. BILLABLE CONTACT HOURS: 4"
HVA 1650,Troubleshooting Air Conditioning,2,This course is designed to give students the concepts and skills that emphasize the use of gauges and electrical instruments to diagnose and troubleshoot air conditioning equipment. BILLABLE CONTACT HOURS: 2.5
HVA 1700,Heating Regulations,2,"Heating Regulations is required by all students as preparation for obtaining a license. It will provide the student with Local and National Codes governing the safe design, construction, installation, testing and licensing as applied to heating. Safety features required for various types of fuel burning equipment, pressure vessels and system application. Rules applying to existing buildings and new construction. Requirements for approved equipment. Inspection and enforcement regulations. Relief devices and testing. BILLABLE CONTACT HOURS: 2"
HVA 1800,Advanced Controls,3,"This course is designed to investigate the theory, operation, design considerations, and servicing of advanced commercial and industrial proportional control systems. Additional emphasis will be given to proportional single zone and multi-zone/VAV systems, as well as other proportional applications as presently used and/or proposed in automated building control. BILLABLE CONTACT HOURS: 4"
HVA 2010,Solar and Other Renewable Energy Systems,4,"The student will learn and demonstrate the principles of energy efficient and solar design analysis and construction. Students will analyze the solar energy systems and will calculate solar savings fractions, backup heat needs, and economic analysis. The student will investigate the technologies and applications of other non-polluting and renewable forms of energy including wind power, photovoltaic, and alternative transportation vehicles. BILLABLE CONTACT HOURS: 4"
HVA 2400,Energy Management,4,"The student will perform critical examinations of energy consuming facilities both domestic and commercial for the purpose of identifying energy conservation opportunities. In addition, the student will identify various energy conservation techniques as well as equipment which can be installed to further conserve energy. Energy audits will be performed at various facilities in the students' vicinities. BILLABLE CONTACT HOURS: 4"
HVA 2510,Direct Digital Controls,3,"This course is designed to investigate the theory, operation, design considerations, and servicing of advanced commercial and industrial computerized control systems. Additional emphasis will be given to computerized single zone and multi-zone/VAV systems, as well as other computerized applications as presently used and/or proposed in automated building control. BILLABLE CONTACT HOURS: 4"
HVA ELEC HVACR Transfer Elective,,,
HIS 1510,World Civilizations to the Beginning of the Modern Era,4,"In this course we will trace human civilizations from their origins to the era of global interaction (16th century) by exploring their cultural, social, religious, economic and political institutions. We will draw comparisons in order to illustrate the diversity and similarity among civilizations and in order to develop a global view of world systems. BILLABLE CONTACT HOURS: 4 GE Outcomes: Critical Thinking, Global Understanding and Responsibility"
HIS 1520,World Civilizations from the Modern Era,4,"In this course we will trace major characteristics of human civilizations throughout the world beginning with the era of global interaction (16th century) until the present by exploring their cultural, social, ideological, economic, and political institutions. We will draw comparisons in order to illustrate the diversity and similarity among civilizations and in order to develop a global view of world systems. BILLABLE CONTACT HOURS: 4 GE Outcomes: Critical Thinking, Global Understanding and Responsibility"
HIS 1550,Contemporary World,3,"This course examines worldwide political, cultural, social, economic, religious and intellectual trends since World War Two. It provides the student with opportunities to examine the recent past from a global perspective today. BILLABLE CONTACT HOURS: 3 GE Outcomes: Global Understanding and Responsibility"
HIS 1651,Topics in History: The Vietnam War 1887 to Present Day,3,The Vietnam War: 1887 to present day. BILLABLE CONTACT HOURS: 3 GE Outcomes: Effective Communication
HIS 1653,Topics in History: The 1960's,3,The 1960's. BILLABLE CONTACT HOURS: 3 GE Outcomes: Effective Communication
HIS 1654,Topics in History: The JFK Assassination,3,The JFK Assassination. BILLABLE CONTACT HOURS: 3 GE Outcomes: Effective Communication
HIS 1660,Topics in History: The Culture and History of Ancient Egypt,3,The Culture and History of Ancient Egypt. BILLABLE CONTACT HOURS: 3 GE Outcomes: Effective Communication
HIS 1661,Topics in History: Native American Studies,3,Native American Studies will examine indigenous life in the United States from early European contact to the present. There will be an emphasis of reading Native American literature. Cultural habits and language will also be introduced. The class will also dispel myths that are harbored in society today about these people and how the media has represented these cultures. BILLABLE CONTACT HOURS: 3 GE Outcomes: Effective Communication
HIS 1662,Topics in History: Ancient Rome,3,Ancient Rome. BILLABLE CONTACT HOURS: 3 GE Outcomes: Effective Communication
HIS 1663,Topics in History: Ancient Greece,3,Ancient Greece. BILLABLE CONTACT HOURS: 3 GE Outcomes: Effective Communication
HIS 1665,Special Topics in History: History of Detroit,3,"The class will cover the dawn of Detroit (pre-Cadillac to the present). Emphasis will be on indigenous influences as well as different European influences. American wars as well as Detroit's assistance in World Wars will be discussed. Socially, the Civil Rights movement will be as discussed, the effect of the Great Migration, immigration, and the Age of the City. The event of Detroit City being a Great Industrial Center to the period of the Rust Belt will be discussed. Finally, the rebound of today's city will be of final importance. BILLABLE CONTACT HOURS: 3 GE Outcomes: Effective Communication"
HIS 1666,Special Topics in History,3,Topics courses are designed to examine specializations in research within the various fields of history. Refer to the specific section using OCC's online system for current topic. BILLABLE CONTACT HOURS: 3 GE Outcomes: Effective Communication
HIS 1667,Special Topics in History,3,Topics courses are designed to examine specializations in research within the various fields of history. Refer to the specific section using OCC's online system for current topic. BILLABLE CONTACT HOURS: 3 GE Outcomes: Effective Communication
HIS 1700,Michigan History,3,"This course is a survey of the development of Michigan from prehistoric times to the current day. The social, economic, and political development of the state will be studied in relation to the history of the nation. BILLABLE CONTACT HOURS: 3 GE Outcomes: Critical Thinking"
HIS 2510,United States History to 1877,3,"In this course we will examine the dynamic interplay of social, political, military, and cultural forces that shaped the development of what becomes the American Republic from the earliest contacts between Europeans and Native Americans until the end of Reconstruction. BILLABLE CONTACT HOURS: 3 GE Outcomes: Critical Thinking"
HIS 2520,United States History from 1877 to the Present,3,"In this course we will examine selected aspects of the political, economic, social, military, and diplomatic history of the United States since the end of Reconstruction. Among the themes to be emphasized during the span of U.S. history are the growth, maturing and restructuring of an industrial society, the struggle of civil and human rights since the end of Reconstruction, and the activist role of the U.S. in the international arena. BILLABLE CONTACT HOURS: 3 GE Outcomes: Critical Thinking"
HIS 2610,African American History to 1877,3,"This course examines the African American experience from the emergence of ancient African kingdoms through the Middle Passage to slavery in the Americas, from the abolitionist movement through the Civil War and Reconstruction. It discusses the evolution of black American slavery as a legal, social, economic and political institution. This course also studies African American religion, art, music and other contributions to American culture to 1877. BILLABLE CONTACT HOURS: 3 GE Outcomes: Critical Thinking"
HIS 2620,African American History From 1877 to The Present,3,"This course is a survey of African Americans in the United States from 1877 to the present. It explores the post-Reconstruction era, civil rights and black nationalistic movements as the backdrop for considering problems facing a multiracial and pluralistic society today. It traces the development of African American religion, art, music and other contributions while also examining the concepts of racism, desegregation/integration and separatism and the role of law. BILLABLE CONTACT HOURS: 3 GE Outcomes: Critical Thinking"
HUM 1510,Arts and Literature: Origins of Western Traditions,3,"The course focuses on European and Middle Eastern art, architecture, literature and music from prehistoric times to the Renaissance. Comparisons with other cultures are included. Emphasis is placed on lasting meaning in the arts and their relations to philosophical, religious, aesthetic and social/political outlooks. BILLABLE CONTACT HOURS: 3 GE Outcomes: Aesthetic Awareness"
HUM 1520,Arts and Literature: Renaissance Through Modern,3,"The course focuses on traditions and highlights of Western art, architecture, literature and music from the Renaissance through the modern era. In each tradition, relations between the arts are examined. Emphasis is placed on cultural influences and aesthetic principles. BILLABLE CONTACT HOURS: 3 GE Outcomes: Aesthetic Awareness"
HUM 1710,World Religions,3,"A study of the internal development, doctrine, and practice of the known world religions with added emphasis on the cultural, social, and ethical milieu in which the religions developed. The student will be able to compare the many movements, trends, and thoughts of ancient and contemporary religions. BILLABLE CONTACT HOURS: 3 GE Outcomes: Critical Thinking"
HUM 1800,Special Topics in Humanities,3,"Instructors will offer specific topics in interdisciplinary humanities. Each course will explore a topic in relation to two or more forms of expression (e.g. visual or performing arts, literature, philosophy or religion.) These classes will not duplicate any existing courses. Refer to the specific section using OCC's online system for current topics. BILLABLE CONTACT HOURS: 3"
HUM 1801,Special Topics in Humanities,3,"Instructors will offer specific topics in interdisciplinary humanities. Each course will explore a topic in relation to two or more forms of expression (e.g. visual or performing arts, literature, philosophy or religion.) These classes will not duplicate any existing courses. Refer to the specific section using OCC's online system for current topics. BILLABLE CONTACT HOURS: 3"
HUM 1802,Special Topics in Humanities,3,"Instructors will offer specific topics in interdisciplinary humanities. Each course will explore a topic in relation to two or more forms of expression (e.g. visual or performing arts, literature, philosophy or religion.) These classes will not duplicate any existing courses. Refer to the specific section using OCC's online system for current topics. BILLABLE CONTACT HOURS: 3"
HUM 1900,Introduction to Film,3,"This course offers a basic introduction to film study with a comprehensive view of motion pictures as a communications medium, an industry, and an art form. It includes historical highlights, aesthetic and critical approaches, and fundamentals of production. BILLABLE CONTACT HOURS: 3 GE Outcomes: Aesthetic Awareness"
HUM 2101,Topics in Film: World Cinema,3,World Cinema. BILLABLE CONTACT HOURS: 3
HUM 2103,Topics in Film: Great Directors,3,Great Directors. BILLABLE CONTACT HOURS: 3
HUM 2104,Introduction to Documentary,3,"This course offers historical and aesthetical developments in documentary and non-fiction film, the processes involved in cinematic criticism and analysis, as well as the major artistic, historical, and cultural aspects of documentary film. BILLABLE CONTACT HOURS: 3"
HUM 2105,Topics in Film: Film Noir,3,Film Noir. BILLABLE CONTACT HOURS: 3
HUM 2106,Topics in Film: Comic Books Into Film,3,Comic Books into Film. BILLABLE CONTACT HOURS: 3
HUM 2107,Topics in Film: Documentaries,3,Documentaries. BILLABLE CONTACT HOURS: 3
HUM 2720,Bible,3,This course will focus on scripture texts. Hebrew and Christian texts will serve as models for analysis and interpretation. The textual studies will describe the origin of the traditions. The cultural influences on the development of scripture themes will be examined. BILLABLE CONTACT HOURS: 3 GE Outcomes: Critical Thinking
HUM 2900,Literature Into Film,3,"Students will do in-depth critical analysis of both literature and film, considering the processes by which film is adapted from literature and investigating how film and literature complement each other theoretically, stylistically, and thematically. BILLABLE CONTACT HOURS: 3"
IST 1000,Industrial Math I,3,"This course will provide the industrial focused student with the fundamentals of Algebra, Geometry and simple angle calculations as applied to practical industrial problems that arise in skilled trades areas. Topics include, but not limited to: solving for variables, ratio and proportion, percentage, tapers, area, perimeter, volume, circumference, circle definitions, and solving angle calculations using Sine, Cosine and Tangent. Satisfactory completion of secondary school algebra or equivalent is recommended. BILLABLE CONTACT HOURS: 3"
IST 1100,Industrial Math II,3,"This course provides the student with the basic principles of trigonometry as applied to industrial problems. Topics covered are basic trigonometric functions, functions of angles, relations between trigonometric functions, tables and their uses, and solution of right angles. It will also cover the interpolation of angles to the nearest second of a degree, solution of oblique triangles by right triangle methods, Law of Sines, and Law of Cosines. BILLABLE CONTACT HOURS: 3"
