course_code,course_name,credit_hours,description
CRJ 1408,Special Topics in Homeland Security,3,"These courses provide students with an extra focus on major issues that have current visibility in debates about homeland security. Presentations and discussions will focus on the latest public debates, including legislative, and their impact on community awareness, preparation, and support for public health emergencies and recovery. Students will have an opportunity to develop ideas about cooperating with their counterparts across international borders and with the increasing social diversity of large and small immigrant communities. These courses are designed to provide students with an opportunity to read more in-depth on particular issues within these broad areas of homeland security policy debate. BILLABLE CONTACT HOURS: 3"
CRJ 1409,Special Topics in Homeland Security,3,"These courses provide students with an extra focus on major issues that have current visibility in debates about homeland security. Presentations and discussions will focus on the latest public debates, including legislative, and their impact on community awareness, preparation, and support for public health emergencies and recovery. Students will have an opportunity to develop ideas about cooperating with their counterparts across international borders and with the increasing social diversity of large and small immigrant communities. These courses are designed to provide students with an opportunity to read more in-depth on particular issues within these broad areas of homeland security policy debate. BILLABLE CONTACT HOURS: 3"
CRJ 1410,Special Topics in Homeland Security,3,"These courses provide students with an extra focus on major issues that have current visibility in debates about homeland security. Presentations and discussions will focus on the latest public debates, including legislative, and their impact on community awareness, preparation, and support for public health emergencies and recovery. Students will have an opportunity to develop ideas about cooperating with their counterparts across international borders and with the increasing social diversity of large and small immigrant communities. These courses are designed to provide students with an opportunity to read more in-depth on particular issues within these broad areas of homeland security policy debate. BILLABLE CONTACT HOURS: 3"
CRJ 1411,Special Topics in Homeland Security,3,"These courses provide students with an extra focus on major issues that have current visibility in debates about homeland security. Presentations and discussions will focus on the latest public debates, including legislative, and their impact on community awareness, preparation, and support for public health emergencies and recovery. Students will have an opportunity to develop ideas about cooperating with their counterparts across international borders and with the increasing social diversity of large and small immigrant communities. These courses are designed to provide students with an opportunity to read more in-depth on particular issues within these broad areas of homeland security policy debate. BILLABLE CONTACT HOURS: 3"
CRJ 1412,Special Topics in Homeland Security,3,"These courses provide students with an extra focus on major issues that have current visibility in debates about homeland security. Presentations and discussions will focus on the latest public debates, including legislative, and their impact on community awareness, preparation, and support for public health emergencies and recovery. Students will have an opportunity to develop ideas about cooperating with their counterparts across international borders and with the increasing social diversity of large and small immigrant communities. These courses are designed to provide students with an opportunity to read more in-depth on particular issues within these broad areas of homeland security policy debate. BILLABLE CONTACT HOURS: 3"
CRJ 1720,Correctional Institutions and Facilities,3,"The student will define the purpose of correctional institutions and prisons, including the differentiation between security levels and prisoner classifications. Treatment and rehabilitative programs will be discussed and evaluated. The management and organization of correctional institutions will be described, including the role of the warden, the deputy warden, and the corrections officer. The custodial care and concerns will be defined, including the food service, clothing requirements, and medical requirements of the institution. The safety and security issue will be described. The rights of prisoners and future concerns of incarceration will also be discussed. BILLABLE CONTACT HOURS: 3"
CRJ 1830,"Probation, Parole, and Community Corrections",3,"The course will examine the various concepts, theories, and programs relating to community corrections. The course will provide an understanding that community correction is a sentencing style that represents an increased dependence upon correctional resources which are available in the community, such as probation, parole, electronic monitoring of offenders, diversion projects, community-based release programs, and other matters relating to community corrections. The course will examine the theories, procedures, administration, and implementation of probation and parole as it relates to the correctional client. BILLABLE CONTACT HOURS: 3"
CRJ 2120,Highway and Traffic Control,3,"The student will identify and define the basic police and driver responsibilities for safe and efficient movement of vehicles and pedestrians. The student will apply education, enforcement, and engineering aspects to public services and traffic safety; the student will examine laws, ordinances, and new developments involved in traffic safety, enforcement procedures, and accident investigation. BILLABLE CONTACT HOURS: 3"
CRJ 2154,"Firearms, Ballistics and Explosives Identification",4,"This is a course of study applying forensic science theory and concepts related to firearms, ballistics, and explosives evidence found during a criminal investigation. Course work and hands-on laboratory experiments will utilize modern scientific instruments and techniques for the preservation, analysis, and interpretation of this evidence within limits of safety requirements. BILLABLE CONTACT HOURS: 4"
CRJ 2200,Criminal Investigation and Case Preparation,4,"The student will identify the investigative procedures and techniques used in the process of gathering facts, testing hypotheses, and the proof required in factually concluding that a crime was committed. The student will recognize, collect, and prepare physical evidence for transmission to courts and will prepare a report of an investigation as required in the prosecution of a criminal case. The student will examine physical evidence in a laboratory situation to determine scientific analysis required to assist in case preparation and forensic use. BILLABLE CONTACT HOURS: 4"
CRJ 2220,Juvenile Procedures,3,"The student will identify youth bureau functions and recognize jurisdiction of juvenile agencies and will identify and define prevention methods, determine special reporting procedures, and discuss the theories that explain the problems of delinquency. BILLABLE CONTACT HOURS: 3"
CRJ 2254,Fingerprint Classification and Identification,4,"This is a course of study dealing with fingerprint techniques, recording, and classifying fingerprints; identifying classification patterns and compositions; learning the Henry System of classification and variations to the system; developing, recording, photographing, comparison, and identification of latent fingerprints. Laboratory procedures will be studied in the use of developing power, chemical development of latent prints, and preparation of evidence for court presentation. BILLABLE CONTACT HOURS: 4"
CRJ 2260,Substance Abuse Investigation,3,"This is a course of study relating to the problems of drug abuse (alcohol, dangerous drugs, narcotics). The student will acquire knowledge concerning the issues involved in social impact, physical and psychological results of drugs and alcohol, and the facilities and treatment methods being used to cope with the problems. An identification and recognition of habit-forming drugs will be made by the student associated with criminal law applicable to legal restrictions. Law enforcement and investigation procedures will be presented to maintain an acceptable social control on the substance abuse problem. BILLABLE CONTACT HOURS: 3"
CRJ 2310,Interview and Interrogation Techniques,3,"The student will perform the basic steps involved in interviewing a witness and interrogating a suspect of complaints referred to enforcement agencies. The student will classify witnesses and subjects into categories of behavioral characteristics and psychological reactions, describe methods for taking statements, identify recording devices, and methods for detection of deception. Further, the student will describe the law governing the admissibility of this type of evidence. BILLABLE CONTACT HOURS: 3"
CRJ 2320,Police Administration,3,"The student will identify and explain the functions, activities, and administrative procedures of a police agency. The student will review operational techniques used by police administrators and convert this information into an adequate utilization of resources. Also, the student will examine the executive responsibilities, provide for implementation of command policy, and study auxiliary services in support of police operations. BILLABLE CONTACT HOURS: 3"
CRJ 2403,Field Project,3,"The student will analyze a major research project in the criminal justice or security field collecting data from related references and agencies. Observations will be made on the data collected in a criminal justice agency or a private community-based program. Periodic progress reports will be submitted on the project. At the end of the semester, the student will prepare a research paper outlining the material collected from the agencies, documented from selected references, and indicate the relationship of practical field application to prior courses studied in the associate degree program. BILLABLE CONTACT HOURS: 3"
CRJ 2420,Community Relations in Criminal Justice,3,"The student will study community relations as they relate to the criminal justice processes. The student will develop case studies to analyze basic psychological problems as they relate to the police, courts, and corrections, while coping with changes in social controls over human behavior. Major emphases will be placed on the role of the criminal justice practitioner as he/she deals with such problems as crises intervention, public relations, community based corrections, crime prevention, and conflict with current management policies. BILLABLE CONTACT HOURS: 3"
CUL 1010,"Food Standards, Sanitation and Hygiene",2,"This course will identify sanitation standards and safety practices in the food service industry. Students will identify caustic agents in food borne illnesses, food commonly involved, how the caustic agent is introduced and the corrective measures taken to prevent food borne illness. Material in this course prepares students for ServSafe Certification. BILLABLE CONTACT HOURS: 2"
CUL 1011,Culinary Skills,2,"This course will provide the foundation for skills required in the culinary program. Lecture and demonstrations and hands on learning will include kitchen safety, proper use of equipment, product identification, cooking principles and practices used in the commercial kitchen for effectiveness. Emphasis on knife skills and classic cuts will be practiced. Discussion of the hospitality industry and professionals past and present. Students will be introduced to various career paths in the industry. BILLABLE CONTACT HOURS: 3"
CUL 1050,Beginning Cake Decorating,2,"Students will prepare, color, and blend buttercream and royal icings used in the making of figures, borders, flowers, letters, and script for special occasion cakes. Piping gel and sugar molds will also be used. BILLABLE CONTACT HOURS: 3"
CUL 1060,Theme Cakes,2,"This course will provide students with knowledge and techniques to produce theme and / or special occasion cakes. Emphasis will be on design, color and production of tier cakes. Figure piping and advanced floral design will be practiced. BILLABLE CONTACT HOURS: 3"
CUL 1111,Cookery Techniques,4,"This course will provide the foundation knowledge and techniques practiced in professional cookery. Students will prepare all mediums food product in kitchen lab. Classic methods of cookery will be prepared and evaluated to develop proper skills required of cooks. Emphasis will be on the foundation preparation process of stocks, mother sauces, soups, vegetables, poultry, finfish, small sauces, pork, lamb, beef, shellfish, starches and variety meats. BILLABLE CONTACT HOURS: 6"
CUL 1120,Butchery and Fabrication,2,"This course is designed to teach the student how to cut wholesale and restaurant cuts of beef, veal, lamb, pork, poultry, and fish as well as how to properly store these products. Students will prepare fresh and smoke sausage. Proper handling, sanitation techniques, and meat terminology will be emphasized. BILLABLE CONTACT HOURS: 3"
CUL 1151,Baking,4,"Students will be introduced to the theory and practice used in a commercial bakery. Students will prepare and evaluate the quality of baked goods including the use of mixes, frozen dough, and scratch methods. Preparations will include breads, rolls, danish, coffee cakes, puddings, pies, cookies, cakes, custards, and puff pastry. BILLABLE CONTACT HOURS: 6"
CUL 1180,Hospitality Careers,1,"This course will provide students an insight to the career opportunities within the hospitality industry. Through a series of field trips, the students will visit various styles of hospitality operations and meet with industry leaders. Discussion will focus on business operations, current trends, and maintaining success in a competitive industry. Field trips are required. BILLABLE CONTACT HOURS: 1"
CUL 1200,Restaurant Cookery,4,"This course provides the students knowledge and techniques necessary to prepare food in a working restaurant operation. Students will rotate through multiple cook stations of the kitchen to experience the preparation procedures of each station utilizing a market menu. Students will prepare various soups, sauces, meat, fish, poultry, and starches for a full-service restaurant. BILLABLE CONTACT HOURS: 6"
CUL 1250,Pastry I,4,"The student will learn to produce contemporary pastries that would appear on the menus of finer restaurants. Emphasis is placed on preparation of petit fours and French pastry, puff pastry and pate choux specialties, gateaus and tortes, ice cream, and includes an introduction to plated desserts. BILLABLE CONTACT HOURS: 6"
CUL 1300,Garde Manger,4,"This course provides the knowledge and skills required of the garde manger kitchen. Study begins with discussion and preparation of various styles of cold sauces, dressing, salads, sandwiches as prepared in today's kitchens. Students will setup and properly execute food items from the cold food station of the restaurant. Course will advance student to include preparation of force-meats, cured and smoked foods, pickling and preserves, garnishes and cold platter presentation. BILLABLE CONTACT HOURS: 6"
CUL 1400,Front House Operations I,4,"This course will provide students an in-depth understanding of food and beverage service in restaurant operations. Emphasis will be on the principles and practices of dining room service. Proper steps of service, use of industry software, guest etiquette and sales merchandising will be practiced. Students will learn and practice skills required of the dining room manager including supervisory techniques, labor relations, understanding sales reports and guest relations. Lifesaving techniques practiced in dining guest emergencies will be demonstrated. BILLABLE CONTACT HOURS: 6"
CUL 1850,Bakery Sales and Merchandising,4,"This course provides students a hands on experience to operate a bakery retail counter. Emphasis will be on organization, packaging, merchandising and sales of bakery products. Cost formulas,customer order processes, and methods of effective production will be practiced. Students will plan and execute a themed bakery sales event utilizing various bakery products. Techniques of creating dynamic display cases for profitability will be covered. BILLABLE CONTACT HOURS: 6"
CUL 2020,Food Service Cost Management,3,"This course will focus on the importance of control in the modern food service industry. Food, labor and beverage costs will be examined in depth as well as the relationship these costs have to the profitability of the operation. Students will practice calculating cost-to-sales ratios and cost/volume/profit equations. BILLABLE CONTACT HOURS: 3"
CUL 2030,Food Purchasing and Storage,2,"This course will introduce students to food purchase systems used in food and beverage operations. Emphasis will be on developing food product specifications for quality control. Methods of inventory used for food and beverage, bid buying, purveyor selection, receiving and product storage will be discussed and practiced. BILLABLE CONTACT HOURS: 2"
CUL 2200,Modern Buffet Techniques,4,This course presents knowledge and skills necessary to plan and execute volume banquet service. Emphasis will be on menu planning and presentation for banquets and buffets. Methods and techniques of modern and traditional cookery will be practiced while producing theme events for the dining public. Appetizers and breakfast cookery will also be included. BILLABLE CONTACT HOURS: 6
CUL 2250,Pastry II,4,"The student will practice advanced techniques used in pastry production. Emphasis will be placed on holiday pastries, confectionery products, tortes, composed desserts, sugar, and chocolate work. BILLABLE CONTACT HOURS: 6"
CUL 2300,Ice Carving,2,This hands-on course will include knowledge and skills necessary to produce a sculpted ice carving for table centerpieces used in special events. Safety with power hand tools will be discussed and practiced in This course. BILLABLE CONTACT HOURS: 3
CUL 2301,Ice Carving Competition,2,"Students will be provided an opportunity to learn ice carving techniques used in national competitions. Planning, timing and execution of innovative concepts will be discussed. Organizational skills for successful ice carving entry will be practiced. Travel to events may be required. BILLABLE CONTACT HOURS: 3"
CUL 2320,Wine and Spirits,3,"The student will develop an overall knowledge of the beverage industry as it relates to food and beverage operations. A full line of liquor, beer, and wine will be discussed along with standard practices in the service and mixology of these. The student will be exposed to the importance of professional management and the application of management functions in the areas of staffing, product control, accounting, legal liability, and merchandising. BILLABLE CONTACT HOURS: 3"
CUL 2330,Artisan Breads,2,This course presents advanced theory and techniques of producing artisan breads and will include developing and maintaining cultures used in sourdough. Correct choice of flours and ingredients for specific flavor development will be covered. Students will participate in flavor and product evaluations. BILLABLE CONTACT HOURS: 3
CUL 2350,Culinary Competition,2,This course is design to prepare the student for culinary competition both as a team and individual entry. American Culinary Federation culinary standards will be discussed and practiced for product development. Students will be required to enter an actual culinary competition to be determined by the instructor. Practice will be required outside of class time. BILLABLE CONTACT HOURS: 3
CUL 2360,Soups and Sauces,2,"This course will provide students an in-depth study of soups and sauces, both classical and nouvelle. Discussion and preparation of unique sauces will allow students to hone skills in sauce making techniques. Various styles of seasonal soups and garnishes will be prepared. BILLABLE CONTACT HOURS: 3"
CUL 2400,Classical Restaurant,4,"This course will build on foundation skills from previous courses in cooking. The course will introduce the student to classical and international cuisine, and students will practice preparation and service of these cuisines in a fine dining setting. BILLABLE CONTACT HOURS: 6"
CUL 2410,Front House Operations II,2,"This course will provide students with the knowledge and refined skills required in a fine dining operation. Wine varietals, food and wine pairing will be discussed and practiced. The student will be introduced to team service and table-side food preparation pairing. BILLABLE CONTACT HOURS: 3"
CUL 2420,Plated Dessert I,2,"This course builds upon the fundamentals of pastry creations in the form of plated desserts. Design, plate component, and style dynamics will be discussed. The student will practice advanced techniques in plate design to create trend-setting presentations. BILLABLE CONTACT HOURS: 3"
CUL 2480,Event and Catering Management,3,"The student will experience skills required of a leadership position in hospitality as they plan, organize, and execute on-premise dinner events. Emphasis is on organizational skills, leadership, and labor relations and creativity required of event planning. The students will work as a team while leading student volunteers to perform the various functions required to execute a successful event for the dining public. BILLABLE CONTACT HOURS: 3"
CUL 2500,Culinary Internship,2,This course will provide the student with a work-based learning experience in an approved restaurant setting. The intern will be evaluated on work performance. BILLABLE CONTACT HOURS: 2
CUL 2530,Wedding Cake Design,2,"The student will design and produce traditional and contemporary wedding cakes. The process of creating cakes for special events, including choice of themes and client relations, will be discussed. BILLABLE CONTACT HOURS: 3"
CUL 2531,Special Techniques for Cakes,2,"This course will provide students with knowledge and techniques used with sugar paste. The course will cover both traditional and contemporary techniques used in sugar art for cake decoration. Course will include use of gumpaste, nontoxic paste, and fondant. BILLABLE CONTACT HOURS: 3"
CUL 2630,Hospitality Internship,2,Internship students will be employed in positions of responsibility as trainees in an approved hotel or food and beverage operation. They will be under the supervision of the employer and are responsible for work assigned to them. Students will complete a work journal and a final report which includes evaluations by the employer. BILLABLE CONTACT HOURS: 2
DHY 1140,Dental Office Procedures,3,"The student will develop skills relative to planning, organizing and controlling the dental office. This course will include dental office procedures such as reception duties, record control, bookkeeping and banking procedures, credit and collecting, insurance forms, supplies and inventory control and patient recall. BILLABLE CONTACT HOURS: 3"
DHY 1230,"Oral, Head and Neck Anatomy",3,"This course provides a comprehensive study of oral, head and neck anatomy including: skeletal, nerves, circulatory, lymphatic, muscular systems, and the relationship to dental hygiene clinical procedures, including local anesthesia. A comprehensive study of the oral and dental anatomy as it relates to oral disease and dental hygiene care. BILLABLE CONTACT HOURS: 4"
DHY 1240,Dental Embryology and Histology,3,This course familiarizes students with the ontogeny of humans with emphasis on the development of the maxillofacial area and dental structures. Skill is developed in the correct use of a microscope and recording of embryological and histological tissue sections. BILLABLE CONTACT HOURS: 4
DHY 1250,Clinical Techniques,5,"This course provides an introduction to the profession of dental hygiene. Students are instructed in the concepts and techniques essential in providing comprehensive dental hygiene care. Through a simulated clinical laboratory experience, the students practice operatory preparation, infection control procedures, patient assessment, and periodontal instrumentation. All procedures are taught to clinical competence. BILLABLE CONTACT HOURS: 8"
DHY 1260,Dental Radiography,3.5,"Theories and principles of the X-ray, its nature and properties and recognition of the normal anatomical structures present in a properly exposed set of periapical and interproximal radiographic images. Practice is provided in exposure, development and mounting of dental radiographic images using a variety of techniques. BILLABLE CONTACT HOURS: 5"
DHY 1281,Clinical Dental Hygiene I,4,"This course is a continuation of Clinical Techniques, providing a transition from the pre-clinic setting to planning and providing dental hygiene care. The emphasis is on applying the knowledge and skills that will foster problem solving and evidence based decision making as it is related to both oral and physical health. The course will explore concepts and techniques of dental care with patients to increase their awareness of dental health including radiographic technique, administering Nitrous Oxide/Oxygen Sedation and Local Administration, and dental anxiety reduction. All facets of clinical dental hygiene processes and procedures are taught to clinical competence. BILLABLE CONTACT HOURS: 7"
